{
  "classification": "INVALID",
  "context": {
    "dialect": null,
    "policy": {},
    "requires": [],
    "tzdb_min": null,
    "tzdb_pin": null
  },
  "corpus_version": "1.0.0-rc3",
  "expectation": {
    "error_class": "field_value_out_of_range",
    "mode": "reject",
    "note": "Engines MUST reject; a silent clamp to 7 or 1 is a conformance failure."
  },
  "family": "cron.dow-numbering",
  "id": "CRON-DOW-004",
  "input": {
    "count": 1,
    "expr": "0 12 * * 8",
    "fields": 5,
    "inclusive": false,
    "kind": "cron",
    "start": "2026-01-01T00:00:00",
    "zone": null
  },
  "kind": "cron",
  "lifecycle": "active",
  "normative_evidence": [
    {
      "source_id": "posix-crontab"
    },
    {
      "source_id": "crontab5"
    },
    {
      "source_id": "quartz"
    }
  ],
  "operation": "cron.parse",
  "rationale": "Range enforcement is the cheapest observable conformance property and is not universal.",
  "schema_version": "1.0.0",
  "semantic_axes": [],
  "tags": [
    "dow",
    "invalid"
  ],
  "title": "Day-of-week 8 (out of range in every dialect)"
}
