{
  "classification": "NORMATIVE",
  "context": {
    "dialect": null,
    "policy": {},
    "requires": [],
    "tzdb_min": "2025c",
    "tzdb_pin": null
  },
  "corpus_version": "1.0.0-rc3",
  "expectation": {
    "mode": "single",
    "occurrences": [
      "1997-09-29T09:00:00-04:00|1997-09-29T13:00:00Z",
      "1997-10-30T09:00:00-05:00|1997-10-30T14:00:00Z",
      "1997-11-27T09:00:00-05:00|1997-11-27T14:00:00Z",
      "1997-12-30T09:00:00-05:00|1997-12-30T14:00:00Z",
      "1998-01-29T09:00:00-05:00|1998-01-29T14:00:00Z",
      "1998-02-26T09:00:00-05:00|1998-02-26T14:00:00Z",
      "1998-03-30T09:00:00-05:00|1998-03-30T14:00:00Z"
    ]
  },
  "family": "rrule.by",
  "id": "RRULE-BY-013",
  "input": {
    "count": 8,
    "ics": "DTSTART;TZID=America/New_York:19970929T090000\nRRULE:FREQ=MONTHLY;BYDAY=MO,TU,WE,TH,FR;BYSETPOS=-2;COUNT=7",
    "kind": "rrule",
    "zone": "America/New_York"
  },
  "kind": "rrule",
  "lifecycle": "active",
  "normative_evidence": [
    {
      "quote": "The second-to-last weekday of the month: ... ==> September 29;October 30;November 27;December 30;January 29;February 26;March 30",
      "source_id": "rfc5545-3.8.5.3"
    }
  ],
  "operation": "rrule.expand",
  "rationale": "Negative BYSETPOS plus a five-value BYDAY is the standard business-day idiom and the most common BYSETPOS in the wild.",
  "schema_version": "1.0.0",
  "semantic_axes": [],
  "tags": [
    "bysetpos",
    "business-day"
  ],
  "title": "BYSETPOS=-2 (second-to-last weekday of the month, RFC example)"
}
