{
  "classification": "AMBIGUOUS_STANDARD",
  "context": {
    "dialect": null,
    "policy": {},
    "requires": [],
    "tzdb_min": "2025c",
    "tzdb_pin": null
  },
  "corpus_version": "1.0.0-rc3",
  "expectation": {
    "cases": [
      {
        "label": "drop",
        "note": "Published RFC text: the nonexistent instance is ignored and not counted, so COUNT=4 reaches 2026-03-10.",
        "occurrences": [
          "2026-03-06T02:30:00-05:00|2026-03-06T07:30:00Z",
          "2026-03-07T02:30:00-05:00|2026-03-07T07:30:00Z",
          "2026-03-09T02:30:00-04:00|2026-03-09T06:30:00Z"
        ],
        "when": {
          "rrule.gap": "omit"
        }
      },
      {
        "label": "pre-gap-offset",
        "note": "Erratum 4271 routed through §3.3.5: 02:30 EST = 07:30Z, which is 03:30 EDT in wall-clock terms.",
        "occurrences": [
          "2026-03-06T02:30:00-05:00|2026-03-06T07:30:00Z",
          "2026-03-07T02:30:00-05:00|2026-03-07T07:30:00Z",
          "2026-03-08T02:30:00-05:00|2026-03-08T07:30:00Z",
          "2026-03-09T02:30:00-04:00|2026-03-09T06:30:00Z"
        ],
        "when": {
          "rrule.gap": "pre_gap_offset"
        }
      },
      {
        "label": "imaginary-local",
        "occurrences": [
          "2026-03-08T02:30:00-04:00|2026-03-08T06:30:00Z"
        ],
        "when": {
          "rrule.gap": "imaginary"
        }
      }
    ],
    "mode": "admissible",
    "note": "python-dateutil emits 2026-03-08T02:30:00-04:00, a datetime for which dateutil.tz.datetime_exists() returns False: it neither drops the instance nor resolves it via the pre-gap offset."
  },
  "family": "rrule.dst",
  "id": "RRULE-DST-001",
  "input": {
    "count": 5,
    "ics": "DTSTART;TZID=America/New_York:20260306T023000\nRRULE:FREQ=DAILY;COUNT=4",
    "kind": "rrule",
    "zone": "America/New_York"
  },
  "kind": "rrule",
  "lifecycle": "active",
  "normative_evidence": [
    {
      "note": "the published text",
      "quote": "Recurrence instances falling on invalid dates and times are ignored and not counted",
      "source_id": "rfc5545-3.3.10"
    },
    {
      "quote": "invalid dates keep MUST-ignore; nonexistent local times are 'handled as specified in Section 3.3.5'",
      "source_id": "eid4271"
    },
    {
      "quote": "If the local time described does not occur ... the DATE-TIME value is interpreted using the UTC offset before the gap.",
      "source_id": "rfc5545-3.3.5"
    }
  ],
  "operation": "rrule.expand",
  "rationale": "Three positions on nonexistent local times — published RFC, Verified erratum, and the most-used reference implementation — and none is what a user would predict. This is the vector that most directly falsifies 'RFC 5545 compliant' as a claim.",
  "schema_version": "1.0.0",
  "semantic_axes": [
    "rrule.gap"
  ],
  "tags": [
    "gap",
    "errata",
    "headline"
  ],
  "title": "Daily 02:30 across the US spring-forward gap"
}
