{
  "classification": "INVALID",
  "context": {
    "dialect": null,
    "policy": {},
    "requires": [],
    "tzdb_min": null,
    "tzdb_pin": null
  },
  "corpus_version": "1.0.0-rc3",
  "expectation": {
    "error_class": "field_count",
    "mode": "reject",
    "note": "Must be rejected. Engines that pad a missing field with '*' produce a schedule the author never wrote."
  },
  "family": "cron.field-count",
  "id": "CRON-FIELDS-005",
  "input": {
    "count": 1,
    "expr": "0 12 * *",
    "fields": 5,
    "inclusive": false,
    "kind": "cron",
    "start": "2026-01-01T00:00:00",
    "zone": null
  },
  "kind": "cron",
  "lifecycle": "active",
  "normative_evidence": [
    {
      "source_id": "posix-crontab"
    },
    {
      "source_id": "crontab5"
    }
  ],
  "operation": "cron.parse",
  "rationale": "Silent padding is observed in the wild; this vector makes it falsifiable.",
  "schema_version": "1.0.0",
  "semantic_axes": [],
  "tags": [
    "fields",
    "invalid"
  ],
  "title": "Four fields (too few)"
}
